player,team,pos,tldr,summary,c_fastball,f_fastball,c_slider,f_slider,c_command,f_command,sits_low,sits_high,tops,c_hit,f_hit,c_raw,f_raw,c_game,f_game,c_run,f_run,c_field,f_field,throw,c_curveball,f_curveball,c_change,f_change,c_cutter,f_cutter
AJ Smith-Shawver,atl,SP,"Smith-Shawver has big long-term ceiling. He hasn’t focused on baseball for very long and still reached Atlanta at age 20-21 amid injuries and changes to his repertoire. Once his mechanics click, look out.","A two-sport Texas Tech commit coming out of high school, Smith-Shawver raced to the big leagues in his second full season even as his repertoire and delivery were evolving. His strike-throwing stagnated during a homer-prone 2024 at Triple-A, but the barely-22-year-old Smith-Shawver (who also dealt with a grade two oblique strain last year) still checks basically every athletic box you’re looking for in an impact pitcher and he hasn’t focused solely on baseball for very long. Since he was drafted, the Braves have augmented AJ’s release point and, in 2022, altered the shape of his slider. In 2023, he added a mid-70s rainbow curveball that complements the shape of his riding mid-90s fastball. In 2024, he suddenly had a plus-flashing changeup. For Smith-Shawver to have entered pro ball as a fastball/slider projection guy and, amidst all these changes, reached the big leagues before he was legally allowed to drink is remarkable.

A super loose 6-foot-3, Smith-Shawver’s mechanical consistency should improve with reps. His fastball’s velocity and ride give it margin for error in the strike zone, but his secondary pitches (especially his slider) need to be located more consistently if they’re going to thrive. The developmental imperative for AJ and the Braves is to find more consistent slider release, so that that pitch is located off the plate rather than constantly backing up into the wheelhouse of righty batters.

I’m consciously avoiding prospect fatigue here — were Smith-Shawver a college righty sitting 95 mph with his changeup quality, we’d be talking about him as a lock to be a top 10 pick. The Braves’ aggressive promotion schedule has backed them into a bit of a corner here, as Smith-Shawver has just one option year left, which might impact his role in the short-term. Over time, I think he’ll be a good mid-rotation starter with two plus pitches and, eventually, much better command than he has right now.",60,60,40,45,40,50,93,98,100,,,,,,,,,,,,50,50,55,60,,
Colt Emerson,sea,3B,"Injuries put a damper on Emerson’s 2024 season, but he has electric hitting hands and should be an everyday infielder in a few years, just probably not at shortstop.","Emerson had a loud introduction to pro ball in 2023, as he and the Mariners’ other high school draftees from that year’s class made noise in Modesto. His 2024 was more muted, in part because Emerson missed significant time with a foot fracture during the regular season (and looked slower on defense when he returned), and then was shut down during his Arizona Fall League stint (he raked there) because of a strained hammy. He is now a career .290/.419/.419 hitter in 94 minor league games.

Emerson’s hitting hands are lovely and explosive, working in an aesthetically pleasing loop that creates natural all-fields doubles power. He posted an 87% in-zone contact rate in 2024, and he has terrific feel for the strike zone. As sexy as his swing looks, I’m a tad worried about how his bat path will play against better velocity. Hitters with swings like this tend to cut underneath a lot of right-handed fastballs up-and-away from them. Still, you should keep in mind that Emerson will (probably, hopefully) be going from one extreme hitting environment to another in 2025 as he transitions from Everett to Arkansas, so even if his numbers take a dive, it doesn’t necessarily mean that I’m already right about that.

Emerson is a little too heavy-footed to play shortstop for me. He can throw from tough platforms but is a little too slow-twitch to be a big league shortstop. The Mariners gave him a little run at third base in 2024, and I think that’s his most likely eventual home. That will make it a little more important for Emerson to get to more power than he has to this point, but there should still be enough offense here for him to profile as an average everyday option there.",,,,,,,,,,25,55,45,50,20,50,40,40,30,50,55,,,,,,
Chase Petty,cin,SP,Petty is a phenomenal athlete who altered his approach to pitching in 2024.,"Petty, who touched 102 in high school, came to the Reds from Minnesota during the spring of 2022 in a trade for Sonny Gray. After missing time with an elbow issue in 2023, he had a healthy and complete 2024 season in which he worked 137 innings spent mostly at Double-A Chattanooga, many more frames than he had thrown in any prior year. At the very end of the season, after Petty had been promoted to Louisville, his fastball was still sitting 94-97 mph.

Petty is an incredible on-mound athlete whose body whips around like a tornado throughout his delivery, which looks like a more consistent version of Abner Uribe’s. He has never had issues throwing strikes, and now he’s proven he can sustain plus arm strength under the stress of a starter’s load of innings. Another big development for Petty is that he’s altered his approach with his heater. He formerly used it as a low-in-the-zone sinker, but is now peppering the top of the strike zone with it. Off of that, he works with a low-90s cutter, a mid-80s slider, and a mid-80s changeup. The two-plane version of Petty’s slider is his nastiest pitch, while his cutter and changeup are more about inducing weak contact from lefties. If Petty can continue on this mid-rotation path, he’ll stand apart from the routine failures that most of the hardest throwing high school pitchers in the draft endure. He’s a special athlete with special arm strength and seemed to make relevant tweaks in 2024, while simultaneously increasing confidence that he can actually start by holding his stuff all year. There’s a pretty good chance he debuts at some point in 2025, though he may not exhaust rookie eligibility until 2026.",60,60,60,60,40,45,94,97,99,,,,,,,,,,,,,,40,45,45,50
Agustin Ramirez,mia,C,Ramirez is a power-hitting catching prospect who will essentially be an everyday player by catching part-time and also getting reps at first base and DH.,"In part because of the pandemic and in part because of the crowded field of Yankees catching prospects above him, it took Ramirez four years to exit rookie ball, which he did during a breakout 2023 that saw him climb from Low- to Double-A. In 2024, Ramirez slugged his way to another promotion with a monster .289/.372/.570 first half at Somerset, and he spent a month in Scranton before the Yankees traded him to Miami as part of the Jazz Chisholm Jr. deal.

The 2024 season was Ramirez’s first on the 40-man roster and, due to his immaturity on defense, it was a purely developmental season that used one of his option years. His receiving around the edge of the zone and pure arm strength are both fine, but Ramirez is currently pretty bad at picking balls in the dirt, and his slow exit from his crouch drags his pop times down into a slightly below-average range. He isn’t ready to be a big league defender just yet, but he also isn’t so bad that he has to slide to first base.

This is still a young catcher with rare power at a position where players tend to break late. Ramirez has big bat speed and power, and enough plate coverage to weaponize it. He’s maintained modest strikeout rates despite a max-effort style of swinging, with the finish of Agustin’s backswing so big that it’s often incredibly dangerous for the catcher behind him. He is going to do enough damage to warrant starts at first base and DH like Ryan Jeffers has — essentially an everyday player who catches some of the time. Expect Ramirez to get his feet wet at the big league level in 2025 and get regular at-bats at C/1B/DH, then establish himself as Miami’s primary catcher as soon as he gets a little better at playing defense.",,,,,,,,,,40,45,60,65,40,60,30,30,40,45,45,,,,,,
Thayron Liranzo,det,C,"Liranzo may be on the 40-man roster already, but he’s still raw as a defender. His enormous size and switch-hitting power give him an All-Star ceiling if he can shore those things up.","Liranzo is a huge-framed, power-hitting catching prospect with several very raw attributes. He was part of the Dodgers’ Wilman Diaz/Rayne Doncon/Josue De Paula position player group on the complex and in Rancho Cucamonga, where Liranzo hit 24 bombs in 2023. Promoted to the High-A Midwest League in 2024, Liranzo struggled early in the season, as many hitters in that league do when they shift from training in Arizona to playing in 40 degree weather in Michigan. Liranzo hit .159 in April but slashed .262/.399/.424 the rest of the year. He was traded to Detroit as part of the Jack Flaherty deadline swap, went on a torrid run after the deal, and then continued to rake in the Arizona Fall League.

Liranzo is what I’d call a Michael Myers Prospect: slow-moving but inevitable. He’s raw enough that as he enters 2025, his 40-man platform year, he’s probably still a couple of seasons away from reaching the big leagues, and will need a few more after that to hit his ceiling. Chief among Liranzo’s developmental imperatives are his ball-blocking and throwing accuracy. When he has a clean exchange, Liranzo’s arm is lethal. He has uncommon athleticism for a guy his size and is capable of firing rockets from his knees or from funky arm angles, à la Patrick Bailey, with some pop times hovering around 1.80 seconds late in the 2024 season. So why has Liranzo allowed stolen bases at an 85% clip the last two years? He too often fumbles his exchange and can’t even get a throw off, or has the carry on his throw impacted by having a poor grip on the baseball. His stone-handed issues are evident when he tries to pick short hops, too, though Liranzo began receiving on one knee in 2024 and is learning how to use his size as a ball-blocking barrier from this body position. The physical tools to not only be a viable catcher, but a very good one, are here, and Liranzo is built like a lot of other late-blooming catchers whose size tends to win the war of attrition they’re all constantly fighting.

We can be hopeful that Liranzo will make similar progress on offense. He already has plus power from both sides of the plate at age 21 and will probably have another grade of it at his peak. He’s not a skilled hitter — Liranzo’s swing is grooved and he’s looking to run into mistakes that find the very middle of the zone — but he is very dangerous from both sides of the plate if he gets one. Again, we must remember this scouting axiom: Switch-hitters tend to develop late, as they have two swings they need to get a feel for. There’s evidence this has been happening for Liranzo. His contact rates improved four percentage points (both overall and in the strike zone) in 2024 compared to 2023, though at 69% and 77%, respectively, both marks would rank near the bottom of the primary catcher population. The natural launch in Liranzo’s best swings combined with his ability to mis-hit contact with enough strength to produce whoopsie doubles should allow him to get to power even though he’s going to strike out a ton. Projected as a flawed-but-good primary catcher overall, Liranzo should have some peak power-hitting seasons that make him an All-Star.",,,,,,,,,,20,35,60,70,35,60,30,30,30,40,60,,,,,,
Coby Mayo,bal,1B,"Mayo is an enormous pull hitter who struggled to deal with sliders in 2024. He probably needs to move to first base, where he should get to enough power to be an average regular.","Mayo had a five-year track record of mashing dating back to high school before elevated strikeouts began to creep into his profile once he was promoted to Double-A. Since arriving in Bowie and then Norfolk, his K% has hovered around 25%, while Mayo’s underlying contact rate has slowly dipped into a problematic range, from 75% to 73% to 70%, as he’s progressed up the minor league ladder the last three years. Mayo’s funky, pull-heavy swing generates enormous pull-side power and loft, and he’s on time to destroy fastballs (his splits against plus velocity are great) even though he’s a massive, long-levered 6-foot-5 guy. His tendency to pull off toward the third base side has left him very vulnerable to sliders on the outer half, and as Mayo has faced more sentient pitching at the upper levels, that has been more consistently exploited. In spite of this, Mayo crushed Triple-A (.287/.364/.562) at age 22, including after he returned from a month-long IL stint due to a fractured rib. He looked positively lost during his 17-game, late-season big league call up to Baltimore, in which Coby K’d in nearly half of his plate appearances. He is starting to have a more polarized power-over-hit offensive profile, but Mayo is so strong and his swing is so tailored to get to all of his power in games that he should still be an everyday bat.

Mayo’s profile becomes a little dicey if he ends up at a first base-only defender. His size makes it hard for him to move around at third base, and he has been speculatively projected to right field here at FanGraphs since before he was drafted because that’s the position that best takes advantage of his plus max-effort arm strength. The Orioles have shown no inclination to try Mayo out there, and began to deploy him at first base semi-frequently starting in 2023; he has played about 20 games there each of the last two seasons. It’s not ideal for a hitter whose bat is nearly ready for prime time to still have such an out-of-focus defensive fit. If Mayo can successfully play a more valuable position than first base, it will take pressure off the need for him to resolve his issues with sliders and give him a better chance to be a star-level performer. At first base (where he’s now projected, though I’d still love to see a right field trial ASAP), he’s more of an average regular.",,,,,,,,,,30,40,70,70,55,65,50,40,30,40,70,,,,,,
Kevin Alcántara,chc,CF,"Long, lanky, and loaded with tools and projection, Alcántara is a loose, 6-foot-6 outfielder with massive potential.","Alcántara’s time is nigh, as he enters his final option year in 2025. His looming lack of roster flexibility might force the Cubs, who even after effectively swapping Kyle Tucker in for Cody Bellinger in their outfield, are still flush with big league outfielders at the time of publication, to make a trade that clears room for him to be rostered on Opening Day 2025. That would preserve that final option in the event that Alcántara struggles to find his big league footing and absolutely needs another stretch at Triple-A Iowa to get himself right. This course of events is plausible because Alcántara is still fairly raw and has all the physical markers of a hitter who might require a prolonged adjustment period to actually start hitting.

At a freaky 6-foot-6, Alcántara’s swing is very long and difficult to time. He tends to be late on fastballs and struggles to pull them in the air, but he has plus bat speed and the power to leave the yard to the opposite field even when he isn’t on time. He has plus measureable pop at age 22 and he isn’t even close to being totally filled out; his frame has room for another 15-20 pounds of muscle before Alcántara’s mobility would be threatened by his size. Compounding the hit tool volatility here, however, is Alcántara’s tendency to miss secondary pitches, as he doesn’t identify or adjust to them all that well and had miss rates north of 40% against sliders and changeups in 2024. Alcántara also drives the ball into the ground a lot; his grounder rate was 50% in 2024, but he still managed to have 35 extra-base hits in 111 minor league games (he missed a few weeks with a shoulder injury) because he hits the ball so hard. Center fielders whose contact profiles resemble Alcántara’s include Jose Siri, Michael A. Taylor, James Outman, and Luis Robert Jr., guys whose performance tends to vary a lot year-to-year, and the same will likely be true of Alcántara.

The thing that stabilizes Alcántara’s profile is his center field defense, which has become quite good. He’s a plus runner with plus range and ball skills, and he plays with a fearlessness around the warning track. He’s gotten very good at the minutiae of the position, like deke’ing baserunners or running to a spot to position himself to throw before he’s collected the baseball. With Pete Crow-Armstrong around, Alcántara is more likely to be a potential Gold Glove corner outfielder in Chicago, but here he’s evaluated as a center fielder because, league-wide, that’s the position at which he has the most value. There’s bust risk here, but especially if his ability to lift the ball starts to improve, Alcántara is going to have some All Star-caliber power-hitting seasons and be a very valuable everyday outfielder.",,,,,,,,,,30,35,60,70,45,60,60,60,50,60,55,,,,,,
Jac Caglianone,kcr,RF,"Caglianone was a two-way college player with elite power and arm strength. If his plate discipline and feel for contact improve as he focuses on hitting, he’s going to explode.","The freakishly talented Caglianone presented a serious conundrum to teams picking atop the 2024 draft. He was perhaps as talented and toolsy a college player as there has been in the last decade or so, wielding elite raw power and, for parts of his career, elite fastball velocity, but Caglianone’s plate discipline and command were both so lacking that they threatened his entire profile on both sides of the ball. He slugged .738 and hit 33 homers as a sophomore, then slashed .419/.544/.875 with 35 bombs in his draft year, but long levers and poor ball/strike recognition (his chase rates approached 40% in college) caused Cags to whiff quite a bit more than his 8.2% junior year K% might otherwise indicate. His swing, which features a very aggressive hand load way up and away from his body, takes advantage of Caglianone’s prodigious athleticism to generate nutty power, but it might benefit from being toned down, not only to help stop Cags from striking out too much, but so that he doesn’t drive the ball into the ground so often, which was an issue after the draft. Caglianone looks as impressive in his uniform as anyone in pro baseball (his thighs are practically bursting out of his pants), and he’s strong enough to do damage with a simpler operation. These blemishes create risk, but the notion that Caglianone will polish his hit tool and feel for the strike zone once he’s been allowed to focus on hitting in pro ball makes him a very exciting prospect.

There’s also an exciting fallback option on the mound if strikeouts turn out to be a problem, though that comes with its own risk. Caglianone has an ideal pitcher’s frame at a hulking 6-foot-5. He’s limber and loose and powers down the mound with ease. His fastball sat 97-100 in 2023, and he has a great changeup. But Caglianone’s velocity plummeted in 2024, and he only averaged 92-93 mph from May until the end of the season. His two breaking balls (an upper-80s slider/cutter and a low-80s slurve) are also wildly inconsistent, as is his command and overall feel for pitching. A return to the mound should probably only be explored if Caglianone underwhelms as a hitter for the next couple of seasons. His ceiling as an everyday hitter is big enough that it should be his/Kansas City’s focus until it becomes clear that it isn’t going to work. This guy has 35 homer upside.",,,,,,,,,,30,40,70,80,35,65,40,40,30,50,70,,,,,,
Josue De Paula,lad,LF,De Paula is a loose-in-the-hips corner outfield prospect with enormous power potential that hasn’t been actualized yet.,"For two consecutive years, De Paula has posted an above-average offensive line as a young-for-the-league hitter. He now sports a .291/.411/.420 career line, and his underlying exit velocities are remarkable for a teenager, as they’re nearly plus on the big league scale. This is a big, physical, loose-in-the-hips outfielder with enormous raw power projection and an early-career track record of plus plate discipline and closer-to-average contact rates. There are some funky elements to De Paula’s swing that have prevented him from tapping into his power in games, and that create some hit tool risk that hasn’t yet been exposed. De Paula tends to lose his base as he swings, his mechanics can get handsy (sometimes he still crushes the ball anyway), and he’ll spin out even when he isn’t swinging all that hard. De Paula is also very vulnerable to righty fastballs running up and away from him. He swings underneath a ton of them, which will become more detrimental to his production as he climbs the minors and faces better heaters. This is a prospect who is still more about projection than present ability on both sides of the ball. De Paula is a tentative corner defender with a great arm that he has not yet tamed. He’s talented enough to be valued as a 50 FV prospect because the power-hitting ceiling here is nutty if De Paula and the Dodgers can remedy even a few of his issues.",,,,,,,,,,20,40,55,70,20,60,45,45,20,40,60,,,,,,
Kyle Teel,chw,C,"Teel is a great ball blocker and thrower, and should get to enough of his power to perform like an average primary catcher.","Teel, who raked in high school, opted out of the 2020 draft, raked in college, was picked in the middle of the 2023 first round, and has raked so far as a pro. He posted a 145 wRC+ at Double-A Portland in 2024, his first full pro season, and was promoted to Triple-A Worcester in mid-August. It seemed plausible that Teel might debut in Boston in 2025, in part because he has played so well and in part because incumbent catcher Connor Wong has struggled. Instead, Teel became the most well-rounded member of Chicago’s fairly crowded big league/Triple-A catching contingent when he was included in the Garrett Crochet deal.

Teel does not have the prototypical size and bulk of an everyday catcher; he’s a leaner athlete, and there are times when his lack of strength impacts his receiving and pitch framing at the bottom of the zone. But he does virtually everything else well on defense. He’s a really great ball-blocker and has sensational hands when picking balls in the dirt. Teel’s raw arm strength is average, but he is very accurate even when awkward pitch locations force him to contort his body to throw.

On offense, his skill set has begun to take on a power-over-hit flavor. He takes a lot of high-effort cuts, and the path of his classic, low-ball lefty swing is geared for lift. Teel has struggled to cover fastballs up and away from him enough that his contact rates have fallen a bit below the major league average at catcher, but his playable power and selectivity (which helps him hunt pitches he can drive) should be enough for him to perform like a good primary backstop.",,,,,,,,,,40,45,45,50,40,55,45,40,45,55,55,,,,,,
Josue Briceño,det,C,"Briceño has looked good behind the plate when healthy, and broke out in the Fall League. He’s a well-rounded hitter who needs to prove he can sustain big offensive performance under the rigors of an entire season behind the dish.","Briceño had a monster 2023 spent mostly on the Lakeland complex, slashing .319/.402/.529 with seven homers. He was among this system’s hard-hit leaders at a whopping 42%, one of the few lower-level hitters consistently hitting the ball 95-plus mph that year. He missed most of 2024 due to a strained PCL suffered in mid-May that kept him out until the end of August. He was only able to amass 176 regular season plate appearances and hit .278/.381/.377 (but repeated the 42% hard-hit rate), then Briceño went to the Arizona Fall League and won the League MVP with an absurd .433/.509/.867 line and 10 homers in 25 games.

Briceño has plus pull power and has now had consecutive years with strikeout rates around 14.5%. His power can be neutered if pitchers execute to the outer third of the zone, but Briceño is capable of going the other way to produce singles and doubles. Briceño didn’t catch at all after his knee injury, but he looked pretty good back here before he got hurt, much better than the year before. He does everything fairly well — receiving around the edge of the zone, ball-blocking, throwing — and has improved pretty quickly for such a big, young catcher. He should return to catching in 2025 and projects as an average defender at peak based on his early-2024 look. Another positive development here is Briceño’s conditioning. He looked much more lithe and limber in Arizona, and seemed to have cut weight without sacrificing power. Whereas in 2023, Briceño looked maxed out, he suddenly has positive physical projection. It’s rare for players who miss half the season or more with injury to have also had an overwhelmingly positive year, but that’s the case for Briceño, who looks like a future primary catcher.",,,,,,,,,,30,50,50,60,30,50,30,30,40,50,50,,,,,,
