player,team,pos,tldr,summary,c_fastball,f_fastball,c_slider,f_slider,c_command,f_command,sits_low,sits_high,tops,c_hit,f_hit,c_raw,f_raw,c_game,f_game,c_run,f_run,c_field,f_field,throw,c_curveball,f_curveball,c_change,f_change,c_cutter,f_cutter
Moisés Chace,phi,SP,"Chace has a monster uphill fastball that should enable him to play a prominent role, even if his command doesn’t develop enough for him to start.","Chace has a high-octane arm and checks a bunch of different data and scouting boxes. He has a very athletic drop-and-drive delivery, his arm action breaks the sound barrier, and his heater has exploding life to the eye to go with mid-90s velocity. The data corroborates this: plus extension, low release height, plus vertical movement on his fastball. When Chace is locating his fastball to the belt, hitters have no chance against him. He looks like Bryce Miller did at roughly the same stage, a fastball-heavy 21-year-old of medium build. There is going to be a dominant fastball here, and there are flashes of good secondary stuff that ideally can be polished so Chace can max out, but like Joe Ryan and Miller, when guys have fastballs this good, they tend to pan out.

Chace’s slider flashes late, hitter-freezing, two-plane bend, but it doesn’t do so consistently. His changeup has, at times, ridiculous tailing action and can steal strikes running back over the glove-side corner of the plate, but again this is rare. His release is pretty inconsistent generally, which is totally normal for a 21-year-old with this kind of arm speed, but also creates some relief risk. The Phillies could pull the ripcord with this guy whenever they want and put him in the big league bullpen, and he’d probably be really good right away. Building his innings count by 20 frames or so (he threw 80.1 innings in 2024) in his first option year would tee up Chace to work something closer to a viable starter’s workload in 2026. Either way, unless his command regresses to 2022-23 levels, Chace’s fastball is going to carry him to an important big league role of some kind within the next two to three years.",70,80,45,55,30,45,93,96,97,,,,,,,,,,,,,,30,45,,
Brody Hopkins,tbr,SP,"Hopkins transferred from one small school to another and only began pitching in a serious way during his draft spring. A big-framed guy and exciting athlete, Hopkins’ stuff took a leap within his first year as a pro and he quickly became Seattle’s best pitching prospect before he was dealt for Randy Arozarena.","Hopkins is a converted outfielder who spent his first couple of collegiate seasons at the College of Charleston, where he didn’t pitch very much. It wasn’t until he transferred to Winthrop that he began to pitch regularly in a starter role, and he still managed to lead the Eagles in homers during his draft year even though Hopkins was becoming an “arrow up” prospect on the mound. A big-framed guy and exciting athlete, Hopkins’ stuff took a leap within his first year as a pro, and he quickly became Seattle’s best pitching prospect before he was traded to Tampa Bay as part of the Randy Arozarena deal and was promoted to High-A. Across both orgs he had a strong first full season — 115 IP in 25 starts, 10.41 K/9, 4.15 BB/9, 3.05 ERA — especially for a guy who was still hitting part of the time the prior season.

Hopkins has a low-slot slinger’s delivery akin to Tanner Houck or Camilo Doval. He’s a broad-shouldered 6-foot-4 and has a low-slot, drop-and-drive style, with his arm stroke happening suddenly at the very end of his delivery. This wreaks havoc on hitters’ timing and creates exploding rise-and-tail life up around the hands of righties. He has been up to 99 and, in his first year of focusing on pitching, threw a decent number of strikes. Obviously, with an arm slot like Hopkins’, his slider spells trouble for righties. This pitch has variable movement in the 86-92 mph range. Some of them look like cutters, while others have more length and depth.

It used to be that pitchers with deliveries like this were rarely found in a rotation, but that’s not really true anymore, and it’s becoming less true all the time. If Hopkins can develop a changeup and/or a well-commanded cutter, anything to flesh out his repertoire, he has a great chance to be a mid-rotation starter. He checks basically every athletic box on the scout card, and there are all kinds of late bloomer traits here. Pitching full-time is still very new to Hopkins and the Rays seemed to alter his style of attack after the trade, as he peppered the top of the zone more often. His groundball rate before the deal (59%) and after it (34%) help illustrate the effects of this. This is a very exciting pitching prospect whose floor feels like that of a nasty late-inning reliever. He has a mid-rotation ceiling if he sustains this velo and finds a third pitch.",60,60,55,60,30,40,93,97,99,,,,,,,,,,,,,,40,50,40,55
Cole Young,sea,SS,Young is a viable shortstop with above-average contact and on-base skills. His power might have been down in 2024 due to a wrist injury.,"Young managed to slash .271/.369/.390 at Double-A Arkansas in 2024 even though it’s a pitcher-friendly environment and he was dealing with a nagging wrist issue, which cropped up again in his first and only Fall League game. His underlying exit velos from 2024 are pretty underwhelming, but they’re still just shy of the average among big league shortstops (his contact rates are comfortably above) and were probably impacted by his wrist.

Young does enough on defense to project as a viable shortstop. His hands and exchange are sound, while his arm strength is right on the fringe on what’s permissible on the left side. He’s performed on offense even as he and the Mariners have made changes to his swing, which now includes a lower load. Young also grinds out tough at-bats. He has great plate discipline, spoils tough two-strike pitches, and tends to put the ball in play even when he chases. If he shows up to camp healthy this spring, there’s a chance he grabs hold of the Mariners everyday second base job at some point in 2025. He’s a low-variance everyday middle infield prospect who is unlikely to be a star.",,,,,,,,,,50,60,45,45,35,40,50,50,40,45,50,,,,,,
Jimmy Crooks,stl,C,Crooks is a glove-first catcher who does enough on offense to be the primary guy.,"Crooks has been a consistently above-average offensive performer at each level since entering pro ball, culminating in a 2024 at Double-A in which he slashed a BABIP-aided .321/.410/.498. His underlying contact and power data is closer to average — 73% contact rate, 104 mph EV90 — though Crooks makes consistently hard contact. His batting stance evokes Luis Gonzalez, and Crooks tends to work the opposite way against pitches that aren’t hung breaking balls. It’s a solid offensive skill set for a catcher, and Crooks is a very good one. Basestealers should call Crooks “The Informant,” as he is not on their side no matter his last name, and while he has above-average arm strength, his accuracy is remarkable. So, too, is his ball-blocking. Crooks’ size helps create a flesh wall behind the plate, he ability to backhand balls in the dirt is great, and his strength makes him a good receiver. He’s tracking like a glove-first primary catcher with solid average offense.",,,,,,,,,,35,45,50,50,40,45,20,20,50,60,60,,,,,,
Juan Brito,cle,2B,Brito is a contact-oriented switch-hitter who has improved enough as a defender to play second base at the big league level. His profile is more about floor than ceiling.,"Brito was a 2023 Pick to Click who looked too rough around the edges on defense that year to justify putting in last year’s Top 100. In 2024, as Brito slashed .256/.365/.443 (.320 xwOBA, per Baseball Savant), his defense improved enough to consider him a viable second base defender. Primarily a middle infielder in Colorado’s org before coming to Cleveland as part of the Nolan Jones trade, the Guardians also tried Brito at third base in 2023, and then at a first base and in right field in 2024. It’s not as though Brito is suddenly a Gold Glove second baseman, but he’s consistent enough to play there in big league games, and he’s backed into having uncommon defensive versatility.

Brito’s offensive skill set hovers around average across the board. He has good bat control and some low-ball power from both sides of the plate, though his swing has more consistent lift as a left-handed hitter. Brito hunts fastballs so fastidiously that he tends to chase them, but his bat control allows him to get away with it. Overall, Brito’s contact and power metrics are right in line with the big league average among second basemen. He’s a platoon-neutral player who can hit from both sides of the dish, and now he’s viable at an up-the-middle position, and likely will be at one or two others soon. With Andrés Giménez gone, Brito has a shot to win Cleveland’s everyday second base job.",,,,,,,,,,50,55,45,50,40,45,50,50,40,45,45,,,,,,
Cade Horton,chc,SP,Horton’s fastball velo trended down to an average level before he was shut down with a shoulder injury in late May of 2024. His slider and changeup quality continue to drive his mid-rotation projection.,"Horton was a draft-eligible sophomore who was seen as a “tip of the iceberg” prospect, as he missed his freshman year due to TJ and didn’t focus solely on pitching until pro ball. It seemed as though things were clicking for him at a different level toward the end of the 2022 college season, and the Cubs were emboldened to select him seventh overall that year. In his 2023 pro debut, Horton posted a .996 WHIP across 88.1 innings, reaching Double-A and sustaining the velocity surge he showed during his breakout junior year despite throwing more innings. That didn’t continue in 2024, as Horton’s velo backed up and was more in the 92-95 range before he was shut down with a shoulder strain in late May after just nine starts. He missed the rest of the season and was re-examined during the offseason to see if he was ready to begin a throwing program. His status for the start of 2025 is up in the air.

Horton’s delivery is fairly violent and indeed looks tough on his shoulder. Other aspects of his fastball are unexceptional, so it’s important for Horton to throw hard for that pitch to be effective. His secondary pitches are what drive his mid-rotation projection here. Horton’s slider and changeup both generate plus-plus rates of miss. His slider has rare velocity and two-plane tilt (it’s a weapon against both left- and right-handed hitters), and his screwball changeup gives him another way to get lefties out. Horton will probably work inefficiently as a starter unless his peak velocity returns, and will have to pitch off his secondary stuff a ton. He’s still likely to be an impact pitcher, but suddenly his list of career arm maladies has grown, forcing Horton toward the back of the overall Top 100.",45,45,60,70,40,50,92,95,97,,,,,,,,,,,,50,50,50,60,,
Troy Melton,det,SP,"Melton is a big, strong righty with an impact fastball and secondary stuff that is still emerging as he gets feel for a relatively new delivery.","Melton was one of the youngest college prospects in the 2021 draft as well as a plus on-mound athlete, so when he had a really rough season with an ERA just over 6.00, it was easier to swallow a return to San Diego State. In his fourth year as an Aztec, Melton reworked his arm action and climbed into the fourth round of the 2022 draft.

Melton and the Tigers have continued to make substantial alterations to his stuff, and he has had both bat-missing and strike-throwing success up through Double-A. In 2024, he was generating six feet, 10 inches of extension and sitting 95-97 mph with plus vertical movement from a low release height across 100.2 innings of work. Melton has added roughly five ticks of velocity to his breaking ball since college, and his splinker-style changeup (often mis-classified by automatic pitch tagging) generated plus chase and miss.

Melton is a strapping 6-foot-4, he throws strikes, and he has two plus pitches and several late-bloomer traits. He was young for his graduating class, was mostly a catcher in high school, missed a season due to the pandemic, and now has a fairly new delivery and breaking ball. He was homer-prone in 2024 (20% HR/FB rate), which is a big part of why he carried an elevated ERA, but that’s an unsustainably high rate. Melton was also shut down with a shoulder impingement at the very end of the 2024 season, but he was hitting 98 in a bullpen just before Top 100 publication and seems fine. He’s on pace to debut at some point late in 2025 and compete for a more permanent spot in the middle of Detroit’s stacked rotation in 2026.",60,60,50,50,45,50,94,97,98,,,,,,,,,,,,,,50,60,,
Jefferson Rojas,chc,SS,"Rojas is a young middle infield prospect with a great looking swing. He has terrific underlying data, but has struggled against high fastballs.","Rojas hit so well during 2023 extended spring training that the Cubs sent him to Low-A before the complex-level season had barely began. He hit .268/.345/.404 in 70 games there, and the Cubs sent him straight to High-A South Bend when camp broke in 2024. There Rojas slashed .245/.310/.336 as 19-year-old. He has gorgeous hitting hands, great rhythm and timing, and advanced feel for all-fields contact. Though Rojas’ granular contact data is very strong (he had a 90% in-zone rate in 2024, for instance, which is great), there are very clearly two ways to get him out: backfoot breaking balls and elevated fastballs. He is very likely to require eventual adjustment to deal with at least one of them. He’s still a very exciting offensive prospect, especially for a shortstop, there is just less certainty in this aspect of his prospectdom.

Rojas has the athleticism, range, and actions to project as a viable shortstop, but he needs polish, as you might expect of a teenage shortstop playing a level above what is typical. Rojas’ internal clock is a little slow and he struggles with short hops right now, but the foundation to stay at short is there. He still has an everyday shortstop projection, it’s just a riskier version of it than was previously considered here. His medium frame means he’s unlikely to develop huge power — this guy doesn’t have Elly De La Cruz’s ceiling or anything like that — but he has the talent of an average regular via a blend of contact, power and average shortstop defense. Rojas was initially graded as a 45+ FV on the Cubs list, but as the entire player population was considered, it felt more appropriate that end slot in this area on the Top 100.",,,,,,,,,,25,50,40,50,25,50,45,45,30,45,50,,,,,,
Arjun Nimmala,tor,SS,"Nimmala made swing tweaks in the middle of 2024 and hit for impressive power afterward. He’s a big guy, but he has a shot to stay at shortstop.","Nimmala was one of the youngest prospects in the 2023 draft and also one of the most projectable, both because of his big, broad-shouldered frame and because he’s new enough to baseball to merit deeper, skill-centric projection. He struggled mightily with breaking ball recognition as an amateur, and at his size, it seemed feasible that he might also need to move off of shortstop.

In 2024, Nimmala had his ass handed to him during the first several weeks of the season. He was hitting .167 in the middle of May and was demoted to the complex, where his swing was re-worked. It seems to have made a real difference. Nimmala’s leg kick and the position of his hands as they load were both altered. When he returned to the Dunedin roster, he hit .265/.331/.564 and stroked 13 bombs in his final 53 games.

This isn’t to say Nimmala is suddenly a lock to be an everyday infielder. He still struck out 29.7% of the time during his hot second half of the season, which is a scary rate at Low-A. His overall contact rate (69%) also wasn’t great, but there is at least precedent for power-hitting big leaguers to carry a rate that low and still be impact players. Nimmala already hits the ball very hard. He is a ferocious rotator and is able to generate considerable power because of the strength and quickness of his hitting hands, which are gigantic. Nimmala is able to create big power in a relatively short distance, and his swing isn’t overly noisy or hard to maintain. He’s also elevating the baseball at an Andy Pages-esque 21 degrees of launch on average, and he’s often on time to pull the baseball thanks to a strong top hand through contact. Toward the end of the year, Arjun showed glimpses of being able to cover the outer third and drive the ball to the opposite field gap with power.

Nimmala is also a terrific bender for his size and has a shot to remain at shortstop. That said, his feel for throwing isn’t great, his body doesn’t always sequence well from the ground up, and his mechanics can get out of whack. He needs to work on more consistently transferring his weight from one foot to the other, which he badly struggles with on backhand plays. The tools to be an impact power-hitting shortstop are here, and Nimmala will be 19 for basically all of 2025. He was always going to be a slower burn, and now he’s shown that he can pretty quickly make relevant adjustments.",,,,,,,,,,20,40,55,70,25,60,45,40,30,45,50,,,,,,
Thomas White,mia,SP,White is a big-framed lefty with mid-90s heat and a plus breaking ball.,"As an underclassman, White was sitting in the low-90s, with a snapdragon breaking ball and a great physical foundation on which to layer velocity. He unleashed even more heat at PG National in 2022 (lots of 93-96 mph) and then shut things down for the bulk of showcase season. Leading up to the 2023 draft, White looked more muscular and mature in the body and held mid-90s velocity throughout the spring, albeit under a very conservative workload. The Marlins gave him just over $4 million as one of two first-round prep arms taken that year, the second straight draft where Miami coaxed a high school pitcher away from Vanderbilt. In 2024, White’s first full season, he carried a 2.81 ERA across 21 starts, mostly at High-A. He worked 96 innings and K’d 29.2% of opposing hitters while keeping his walks mostly under control. The strike-throwing aspect of White’s 2024 season is the chief reason he moved into the 100, after that had been a concern while he was an amateur. His fastball averaged 95 mph across the entire season, his curveball morphed into more of a sweeper (which helped it play as a back foot weapon against righties), and while White’s changeup doesn’t have great movement right now, his feel for locating it is pretty good considering he barely had to use it in high school. He’s in the early stages of charting a mid-rotation course.",55,60,55,60,30,50,94,96,97,,,,,,,,,,,,,,40,50,,
Travis Sykora,wsn,SP,"Sykora had a dominant first pro season thanks to his plus velocity, splitter, and advanced control.","As I noted on last year’s Nationals list, you can’t help but malaprop Sykora into “Sequoia,” because at 6-foot-6 and 230 pounds, Travis is the size of a tree. He overpowered high school hitters with a downhill, upper-90s fastball and promising split changeup as an amateur, and the Nationals gave him $2.6 million in the third round of the 2023 draft. Sykora made 20 excellent Low-A starts during his pro debut in 2024. In 85 innings, he posted a 2.33 ERA, a 1.87 FIP, a 39.2% strikeout rate (yow), and a 8.2% walk rate.

Sykora has a low-three-quarters arm slot, but his front side stays tall throughout his delivery. It’s a funky operation that gives him the option of running a two-seamer down toward his arm-side or elevating his fastball at the belt. Sykora did much more of the latter in 2024 while he held mid-90s velo all year. Even as a high schooler, his fastball command was fairly advanced for a pitcher his size and age, but a 8% walk rate in a 6-foot-6 guy’s debut season is even better than one could have hoped for. Sykora’s slider, which doesn’t spin very much but is aided by its natural downhill trajectory, gives him the means to attack east and west off his fastball, while his splitter combines with the elevated version of Sykora’s heater to attack north and south. The direction of the splitter’s movement has been all over the place since Sykora was in high school. At times it can look like a slider, and something about its inconsistency plays mind games with hitters. Both of his secondary pitches generated miss rates north of 50% last year. Just before the Top 100 was published, Mike Rizzo told reporters that Sykora will be out until close to the middle of the 2025 season; he had a hip procedure during the offseason and will start the year in extended spring training. It didn’t impact his grade here, and so long as Sykora’s stuff looks the same when he returns, he’ll still have mid-rotation projection.",55,55,55,60,30,50,93,97,98,,,,,,,,,,,,,,50,60,,
Felnin Celesten,sea,2B,"Celesten is a physical, switch-hitting middle infield prospect who hasn’t played much due to injury.","The early portion of Celesten’s career has been defined by injury. He suffered a hamstring tear before the 2023 DSL season began, an injury that basically cost him the entire season except for a couple of games in Arizona during Fall Instructional League. Then his season was cut short in 2024 when a slide aggravated a wrist issue that had been bothering Celesten on and off for a while. He had surgery and has now only played in 32 actual games as a pro, though he was also scouted a ton during 2024 extended spring training. In those 32 games, Celesten slashed an amazing .352/.431/.568 and produced a 48% hard-hit rate even though his wrist was hurting. Celesten’s physicality stands out immediately and would stand out in a big league clubhouse. He probably weighs 15 or 20 pounds more than when he signed, and every bit of it is muscle; Celesten’s shoulders look like he stuffed grapefruits up his sleeves. This allows him to make a remarkable amount of hard contact with an easy, low-effort swing.

Celesten’s left-handed swing has a beautifully balanced leg kick that takes advantage of his athleticism without getting out of control. His load from that side is pretty aggressive and deep, with the head of the bat tilted toward the pitcher as he prepares to unwind. You can see in the way Celesten’s lower body, hips, and wrists rotate throughout his swing that this is a pretty special and powerful athlete. His swing is currently geared for low-ball contact, and he’s going to be tested by belt-high fastballs as he climbs further up the full-season ladder, but if this guy ever learns how to alter the posture of his body as a means of covering the top of the zone so that his hands can continue to work with their natural loft, he’s going to be a problem. His right-handed swing is nowhere near as authoritative and is often late, but you can see the athletic elements of his cut from that side, too. Celesten’s swing is not actualized for lift just yet — he averaged just two degrees of launch in a small enough sample that it probably isn’t exactly right to say he’s a two degree guy, but he hits a ton of grounders, to be sure.

On defense, I’ve shifted my forecast for Celesten to second base. He was running in the 4.4s from the right side and the 4.3s from the left for me during the spring (I had no ACL run times from him because his contact quality has been too good for him to ever have to run hard), and I also think Celesten’s size at maturity will be bigger than the typical shortstop’s. Hopefully Celesten will stay healthy enough to have a full season at Modesto. He’s still a risky prospect because he simply hasn’t played very much, but his absolute ceiling would give the org something of a Ketel Marte do over.",,,,,,,,,,20,45,50,60,20,55,50,40,35,50,60,,,,,,
